{
  "$schema": "http://json-schema.org/draft-07/schema#",
  "$id": "schema.agent-handoff.v1",
  "title": "Agent Handoff",
  "type": "object",
  "required": [
    "schemaVersion",
    "handoffId",
    "fromAgentId",
    "toAgentId",
    "workflowRunId",
    "payloadType",
    "payload",
    "createdAt"
  ],
  "properties": {
    "schemaVersion": { "const": "1.0" },
    "handoffId": { "type": "string", "pattern": "^handoff_[A-Za-z0-9_-]+$" },
    "fromAgentId": { "type": "string" },
    "toAgentId": { "type": "string" },
    "workflowRunId": { "type": "string" },
    "payloadType": { "type": "string", "minLength": 1 },
    "payload": { "type": "object" },
    "createdAt": { "type": "string", "format": "date-time" }
  },
  "additionalProperties": true
}
